{
  "bundle_id": "sakg-bundle:sealed-goal-0001-03",
  "goal_id": "g-sealed-goal-0001",
  "namespace": "demo-project",
  "nodes": [
    {
      "evidence": [
        {
          "hash": "883e40b5fba186fbec045725a4c32e17fa522be2ff4b227c3ac9abfce02babba",
          "kind": "test",
          "reverification": "re-run the sealed PAEOS command against the CAS artifact",
          "uri": "cas://paeos/evidence/03"
        }
      ],
      "facets": {
        "decision_state": "rejected",
        "example_index": 3,
        "origin": "paeos-l15-l16",
        "reviewed": true
      },
      "id": "sakg://demo-project/Option/01J00000000000000000000F03",
      "label": "Option emission fixture 3",
      "provenance": {
        "origin": {
          "run_id": "sealed-goal-0001",
          "system": "paeos"
        },
        "source_hash": "6e12706262e7e1f2602fc3859d70a23b12acadc0f142fa455fdd7e50822fbc5b"
      },
      "status": "candidate",
      "summary": "Post-seal SAKG emission fixture with evidence references only.",
      "type": "Option"
    }
  ],
  "producer": {
    "system": "paeos",
    "version": "0.1"
  },
  "schema_version": "paeos.sakg.emission-bundle/v1",
  "sealed_at": "2026-09-02T12:00:00Z"
}
