{
  "bundle_id": "sakg-bundle:sealed-goal-0001-06",
  "goal_id": "g-sealed-goal-0001",
  "namespace": "demo-project",
  "nodes": [
    {
      "evidence": [
        {
          "hash": "ac2e07d1a6734136c85dd9f26c9d8b668b183f90041b3c095eafdd29843962b9",
          "kind": "test",
          "reverification": "re-run the sealed PAEOS command against the CAS artifact",
          "uri": "cas://paeos/evidence/06"
        }
      ],
      "facets": {
        "example_index": 6,
        "origin": "paeos-l15-l16",
        "reviewed": true
      },
      "id": "sakg://demo-project/Scar/01J00000000000000000000F06",
      "label": "Scar emission fixture 6",
      "provenance": {
        "origin": {
          "run_id": "sealed-goal-0001",
          "system": "paeos"
        },
        "source_hash": "5ae29fa4c23d08c6b325f76b317b538a8861977cd42cc13570083d8fcb18ad95"
      },
      "status": "candidate",
      "summary": "Post-seal SAKG emission fixture with evidence references only.",
      "type": "Scar"
    }
  ],
  "producer": {
    "system": "paeos",
    "version": "0.1"
  },
  "schema_version": "paeos.sakg.emission-bundle/v1",
  "sealed_at": "2026-09-02T12:00:00Z"
}
