{
  "bundle_id": "sakg-bundle:sealed-goal-0001-02",
  "goal_id": "g-sealed-goal-0001",
  "namespace": "demo-project",
  "nodes": [
    {
      "evidence": [
        {
          "hash": "c534ed8dd5e1249e312db25b7ddbce61e5f3370f67e0dcc7b5d4b27f75a0948f",
          "kind": "test",
          "reverification": "re-run the sealed PAEOS command against the CAS artifact",
          "uri": "cas://paeos/evidence/02"
        }
      ],
      "facets": {
        "example_index": 2,
        "origin": "paeos-l15-l16",
        "reviewed": true
      },
      "id": "sakg://demo-project/TradeOff/01J00000000000000000000F02",
      "label": "TradeOff emission fixture 2",
      "provenance": {
        "origin": {
          "run_id": "sealed-goal-0001",
          "system": "paeos"
        },
        "source_hash": "afcd97cf816d2d93221a67ed9f0fd3d2e95d34b76b29156523a05018900da3aa"
      },
      "status": "candidate",
      "summary": "Post-seal SAKG emission fixture with evidence references only.",
      "type": "TradeOff"
    }
  ],
  "producer": {
    "system": "paeos",
    "version": "0.1"
  },
  "schema_version": "paeos.sakg.emission-bundle/v1",
  "sealed_at": "2026-09-02T12:00:00Z"
}
